EXHIBITID;EXHIBITTITLE;AUTHOR;POSTERURL;INDEX_1;INDEX_2;INDEX_3;DESCRIPTION
1;REMBRANDT;REMBRANDT Harmenszoon van Rijn;https://www.wga.hu/html/r/rembrand/11biblic/02newtet.html;100;0;0;"17세기 네덜란드에서는 종교화의 주문이 거의 없었음에도 렘브란트는 종교화를 끊임없이 그렸다. 초기에 그는 자신과 가족들을 모델로 한 트로니를 많이 그렸다. 트로니는 당시 네덜란드 미술 고유의 장르로, 주문 받아 그리는 초상화가 아니라 화가가 제작하여 일반적인 제목을 붙였던 인물화다. 대부분 얼굴에 뚜렷한 감정과 특징을 드러내면서, 색다른 의상을 입고 있는 경우가 많다. 경매 중독이라고 할 정도로 열정적인 수집가였던 렘브란트는 이국적이고 진귀한 수집품을 트로니를 그리는 데 자주 사용했다. 렘브란트에게 트로니는 초상화와 역사화, 특히 종교화의 중간 지점에 있는 그림이었다."
2;GAUGUIN;GAUGUIN, Paul;https://www.wga.hu/html/g/gauguin/01/early05.html;57;14;28;"고갱을 아웃사이더로 보는 이유는 간단하다. 젊을 때 일확천금도 만져 보지만 결혼과 동시에 한순간 몰락한다. 평생 조국 프랑스와 거리를 두다가 남태평양에서 객사한다. 19세기 말 수많은 화가들이 주목한 예술세계의 테마는 파리의 전경, 신문명, 세기말 부르주아지 등이었다. 하지만 고갱에게는 전혀 무관한 세계다. 본 적도 가본 적도 들어본 적도 없는, 남태평양 작은 섬 주민들의 일상사가 생의 마지막 날까지 추구한 고갱의 관심사다. 고갱은 그 같은 ‘외계의 얘기’를 다양한 방식으로 표현해 후세에 남긴 예술가다. 그림만이 아니라 대리석과 목재를 이용한 조각과 가구, 중국풍의 판화와 신발까지 예술적으로 표현한 인물이다. 그림 한 분야에 특화된 아티스트(Artist)를 뛰어넘는다. 예술에 관한 모든 것을 종합적·총체적으로 이해하고 구현한 레오나르도 다빈치 같은 아티잔(Artisan) 영역에 속하는 전천후 예술가다."
3;GOYA Y LUCIENTES;GOYA Y LUCIENTES, Francisco de;https://www.wga.hu/html/g/goya/2/212goya.html;17;66;17;"전시는 고야가 충실한 궁정화가로서 그린 그림과, 귀족과 교회에 대해 냉소하며 풍자하는 작품들을 나누어 놓고 있다. 이로 인해 그가 생계를 위해 그린 그림과 여가 시간에 개인적으로 그린 그림들의 차이를 한눈에 볼 수 있다. 또 초기 왕립 태피스트리 제작소 시절에 당시 귀족과 서민의 생활을 그린 쾌활한 느낌의 로코코 풍 벽장식 양탄자와 궁정 수석화가 시절 의뢰 받고 그린, 당시 틀에서 크게 벗어나지 않는 세련된 초상화들은 전시공간 중앙의 홀에 전시되어 있다."
4;MANET;MANET, Edouard;https://www.wga.hu/html/m/manet/1/2spanis1.html;45;36;18;"현대미술의 시초는 인상주의라 알려져 있다. 1860년 대 프랑스에서 발전하는 인상주의는 에두아르 마네(Edouard Manet)에서 그 발단을 보인다. 정확히 말하자면, 마네는 인상주의자라기보다는 ‘현대미술’ 그 자체의 선구자이다. 우리가 그를 인상주의자로 알고 있는 것과는 달리, 그는 인상주의 전시에 참여한 적이 없다. 다만, 그의 작품은 이전의 미술과는 구별되는 모종의 ‘현대성’을 띄었고, 이를 추종한 후대 인상주의 작가들이 마네를 ‘인상주의의의 아버지’라 자처한 것이었다."
5;MONET;MONET, Claude;https://www.wga.hu/html/m/monet/01/early11.html;36;36;28;"미술에 대해 풍부한 지식을 가지고 있지 않더라도 한 번쯤은 들어봤을 법한 이름이 있다. 인상파라 불리는 새로운 미술사조를 창시하고, 평생에 걸쳐 빛을 연구하고 캔버스 위에 그 빛의 아름다움을 표현한 위대한 화가. 클로드 모네. 모네는 처음 그림을 그리기 시작한 순간부터 죽음에 이르기까지 60여 년이 넘는 세월 동안 오직 그림에만 몰두하며 끈임 없이 창작활동을 펼쳤다 그의 이름을 딴 일련번호가 매겨진 작품 수만 해도 2050여 점에 이를 만큼, 그림을 향한 그의 열정은 가히 상상 그 이상이었다. 아내를 잃고, 아들을 잃고, 눈이 어두워져 가는 비극적인 상황 속에서도 그는 모든 아픔 과 고통을 예술혼으로 승화시켜 아름다운 작품을 창작해냈다."
6;GOGH;GOGH, Vincent van;https://www.wga.hu/html/g/gogh_van/16/selfpo09.html;29;12;59;"네덜란드 태생 프랑스 화가 빈센트 반 고흐(1853~1890)는 10년의 짧은 기간 동안 850점이 넘는 유화와 1,200점 이상의 소묘를 남겼습니다. 이 중 그의 동생 테오가 소장했던 약 700여 점의 작품과 편지들은 후손들에 의해 ‘암스테르담 반 고흐 미술관’에 영구 전시되어 있습니다. 반 고흐 미술관은 반 고흐의 가족, 후손들이 경험한 그의 작품과 삶을 전 세계인과 함께 공유하고자 현재까지 운영되고 있으며, 세계 수많은 사람들이 찾는 명소입니다."
7;CÃÂZANNE;CÃÂZANNE, Paul;https://www.wga.hu/html/c/cezanne/1/02early.html;33;25;42;"1870년 7월 프랑스-프로이센 전쟁이 터지자 세잔은 징병을 피하기 위해서 파리를 떠나 프로방스로 갔다. 이때 그는 1년 전부터 사귄 젊은 여인 마리 오르탕스 피케를 데리고 갔으며 1886년 마침내 그녀와 결혼했다. 세잔 부부는 마르세유에서 멀지 않은 프랑스 남부 해안의 작은 마을인 에스타크에 정착했다.  그곳에서 그는 풍경화를 그리기 시작했으며 자연을 있는 그대로 충실히 묘사하는 동시에 자연에서 받는 느낌을 표현하는 방법을 연구했다. 그는 인상파 화가들의 방식으로 주제에 접근하기 시작했다. 이 시기에 그린 2점의 풍경화 〈눈 내린 에스타크 Snow at Estaque〉(1870~71)와 〈포도주 시장 The Wine Market〉(1872)을 보면, 초기 양식의 구도로 되어 있으나 이미 더 세련되어 있고 빛의 사실적 표현에 더 많은 주의를 기울이고 있음을 알 수 있다."
8;RUBENS;RUBENS, Peter Paul;https://www.wga.hu/html/r/rubens/10religi/04religi.html;71;14;14;"미술사에서 가장 성공한 화가로 평가되는 루벤스는 실제로도 화가이자 외교관, 인문주의자, 교육자, 사업가로 현실의 삶 속에서 자신의 이상을 마음껏 구현했던 보기 드문 인물이었다. 이번 전시에서는 ‘클라라 세레나 루벤스의 초상’, ‘아기 에리크토니우스의 발견’ 등 루벤스를 대표하는 최고의 걸작들이 처음으로 국내 관객을 찾는다. 장엄하고 화려한 종교화, 신화화 및 역사적 스토리를 간직한 유화스케치들, 루벤스가 직접 제작 지휘한 유명 태피스트리 연작인 ‘데키우스 무스’등 대표작들을 한 자리에서 만나볼 수 있다."
9;BOTTICELLI;BOTTICELLI, Sandro;https://www.wga.hu/html/b/botticel/21/5augustu.html;75;0;25;"이탈리아 르네상스 시대의 화가 산드로 보티첼리(Sandro Botticelli, 1444/45~1510)의 초기부터 만년까지의 작품을 한 자리에서 감상할 수 있는 전시회입니다. 보티첼리의 전 생애에 걸친 작품을 일본에서 전시하는 것은 처음으로 보티첼리의 생애와 작품의 변천을 살펴볼 수 있는 좋은 기회가 될 것입니다. 또한 스승인 필리포 리피(Filippo Lippi, 1406?~1469)와 제자 필리피노 리피(Filippino Lippi, 1457~1504)의 작품도 함께 소개합니다."